{
  "schema_version": "1.0",
  "id": "CLM-IC-004",
  "text": "Restricted to pairs where coder 1 gave a non-UNCERTAIN label, kappa is 0.821 on 63 decisions.",
  "claim_type": "empirical_quantitative",
  "source_ids": [
    "SRC-WLD-AUDIT"
  ],
  "location": {
    "source_id": "SRC-WLD-AUDIT",
    "locator": "RESIDUAL_AUDIT.md section 5.2, sensitivity table, row 'Coder1-confident'",
    "page": null
  },
  "chapter_ids": [
    "CH-JURIMETRICS"
  ],
  "experiment_ids": [
    "EXP-002"
  ],
  "review_status": "unreviewed",
  "limitations": [
    "The second coder is an LLM operating under written decision rules, so this measures agreement with an LLM labeller, not human inter-coder reliability.",
    "The 91-decision sample covers 71 Dutch and 20 Brazilian decisions only; no Canadian decisions."
  ]
}
