{
  "schema_version": "1.0",
  "id": "CLM-DS-002",
  "text": "A search for Dutch connection-obligation vocabulary (aansluitplicht) in 68,654 Dutch administrative court decisions returns 14 hits, all concerning electricity or heat networks and none water or sanitation.",
  "claim_type": "empirical_quantitative",
  "source_ids": [
    "SRC-WLD-AANSLUIT"
  ],
  "location": {
    "source_id": "SRC-WLD-AANSLUIT",
    "locator": "METHODS_NOTE_aansluitplicht.md, abstract",
    "page": null
  },
  "chapter_ids": [
    "CH-JURIMETRICS"
  ],
  "experiment_ids": [
    "EXP-003"
  ],
  "review_status": "unreviewed",
  "limitations": [
    "Cannot be recomputed without the raw Dutch corpus.",
    "Interpreting absence of litigation as evidence of pre-litigation absorption is a theoretical step that needs researcher review."
  ]
}
