{
  "schema_version": "1.0",
  "id": "CLM-TH-001",
  "text": "Hypothesis: the Netherlands absorbs non-standard sanitation connection cases before litigation, Brazil accommodates them through post-litigation adjudication, and Ontario is intermediate.",
  "claim_type": "theoretical",
  "source_ids": [
    "SRC-WLD-CONTEXT"
  ],
  "location": {
    "source_id": "SRC-WLD-CONTEXT",
    "locator": "RESEARCH_CONTEXT.md, 'Two Models of Accommodation' table",
    "page": null
  },
  "chapter_ids": [
    "CH-PRELIM"
  ],
  "experiment_ids": [],
  "review_status": "unreviewed",
  "limitations": [
    "Stated by the researcher as a theory; the Ontario position is explicitly a hypothesis.",
    "No verified comparative evidence is attached yet."
  ]
}
