{
  "schema_version": "1.0",
  "id": "CLM-DS-001",
  "text": "The jurimetric dataset contains 83,596 judicial decisions from Brazil, Canada and the Netherlands (2016-2026).",
  "claim_type": "empirical_quantitative",
  "source_ids": [
    "SRC-WLD-README"
  ],
  "location": {
    "source_id": "SRC-WLD-README",
    "locator": "README.md introduction",
    "page": null
  },
  "chapter_ids": [
    "CH-JURIMETRICS"
  ],
  "experiment_ids": [
    "EXP-003"
  ],
  "review_status": "unreviewed",
  "limitations": [
    "Raw decision files are not in the repository, so the count cannot be recomputed here."
  ]
}
