{
  "schema_version": "1.0",
  "id": "CLM-IC-001",
  "text": "On 91 decisions, three-label Cohen's kappa between coder 1 and the second coder is 0.568, with 71.4% observed agreement (no calibration rule).",
  "claim_type": "empirical_quantitative",
  "source_ids": [
    "SRC-WLD-AUDIT",
    "SRC-WLD-VALIDATION"
  ],
  "location": {
    "source_id": "SRC-WLD-AUDIT",
    "locator": "RESIDUAL_AUDIT.md section 5.2, sensitivity table, row 'Three-label, no rule'; kappa_results.json",
    "page": null
  },
  "chapter_ids": [
    "CH-JURIMETRICS"
  ],
  "experiment_ids": [
    "EXP-002"
  ],
  "review_status": "unreviewed",
  "limitations": [
    "The second coder is an LLM operating under written decision rules, so this measures agreement with an LLM labeller, not human inter-coder reliability.",
    "The 91-decision sample covers 71 Dutch and 20 Brazilian decisions only; no Canadian decisions."
  ]
}
