{
  "schema_version": "1.0",
  "id": "CLM-IC-003",
  "text": "Excluding every pair in which either coder said UNCERTAIN (binary WATER / NOT_WATER), kappa is 0.932 on 59 decisions.",
  "claim_type": "empirical_quantitative",
  "source_ids": [
    "SRC-WLD-AUDIT"
  ],
  "location": {
    "source_id": "SRC-WLD-AUDIT",
    "locator": "RESIDUAL_AUDIT.md section 5.2, sensitivity table, row 'Exclude-UNCERTAIN'",
    "page": null
  },
  "chapter_ids": [
    "CH-JURIMETRICS"
  ],
  "experiment_ids": [
    "EXP-002"
  ],
  "review_status": "unreviewed",
  "limitations": [
    "The second coder is an LLM operating under written decision rules, so this measures agreement with an LLM labeller, not human inter-coder reliability.",
    "The 91-decision sample covers 71 Dutch and 20 Brazilian decisions only; no Canadian decisions.",
    "Excluding uncertain pairs removes the hardest cases (32 of 91) and so favours a high kappa."
  ]
}
